{
  "$schema": "../schema.json",
  "name": "flat-icon",
  "version": 1,
  "default": true,
  "source": { "type": "built-in" },
  "confidence": "high",
  "description": "Clean, modern flat-design style with white background and blue primary palette. Enterprise-ready, approachable. Best for architecture, ER, flowcharts, and general-purpose diagrams.",
  "bestFor": ["architecture", "er", "flowchart", "general"],
  "palette": {
    "primary":   { "fillColor": "#dae8fc", "strokeColor": "#6c8ebf" },
    "success":   { "fillColor": "#d5e8d4", "strokeColor": "#82b366" },
    "warning":   { "fillColor": "#fff2cc", "strokeColor": "#d6b656" },
    "accent":    { "fillColor": "#ffe6cc", "strokeColor": "#d79b00" },
    "danger":    { "fillColor": "#f8cecc", "strokeColor": "#b85450" },
    "neutral":   { "fillColor": "#f5f5f5", "strokeColor": "#666666" },
    "secondary": { "fillColor": "#e1d5e7", "strokeColor": "#9673a6" }
  },
  "roles": {
    "service":  "primary",
    "database": "success",
    "queue":    "warning",
    "gateway":  "accent",
    "error":    "danger",
    "external": "neutral",
    "security": "secondary",
    "container": "primary"
  },
  "shapes": {
    "service":   "rounded=1;whiteSpace=wrap;html=1",
    "database":  "shape=cylinder3;whiteSpace=wrap;html=1;boundedLbl=1;backgroundOutline=1;size=15",
    "queue":     "rounded=1;whiteSpace=wrap;html=1",
    "decision":  "rhombus;whiteSpace=wrap;html=1",
    "external":  "rounded=1;whiteSpace=wrap;html=1;dashed=1;dashPattern=8 4;fillColor=none;strokeColor=#999999",
    "container": "swimlane;startSize=30;fillColor=#B0C4DE;strokeColor=#6c8ebf;swimlaneFillColor=#EDF2FA;"
  },
  "font": {
    "fontFamily": "Helvetica",
    "fontSize": 12,
    "titleFontSize": 14,
    "titleBold": true
  },
  "edges": {
    "style": "edgeStyle=orthogonalEdgeStyle;rounded=1;orthogonalLoop=1;jettySize=auto;html=1",
    "arrow": "endArrow=classic;endFill=1",
    "dashedFor": []
  },
  "extras": {
    "sketch": false,
    "globalStrokeWidth": 1,
    "background": "#FFFFFF",
    "edgeColor": "#555555",
    "cornerRadius": "rounded=1"
  }
}
